この皿はプラスチックで、そして、このコップは紙でできている。;This plate is made from plastic, and this cup is made from paper.;"---N でできている This grammar (でできている）is used when describing something specific. i.e. the ""plate"" and ""cup."""
チーズやヨーグルトは牛乳からできます。;Cheese and yogurt are made from milk.;からできます。  N  から indicates the materials are not immediately obvious. できる is used for general statements.
プラスチックは石油からできる。;Plastic is made from petroleum.;からできます。  N  から indicates the materials are not immediately obvious. できる is used for general statements.
ワインはブドウからできますが、お酒はお米からできます。;Wine is made from grapes, but sake is made from rice.;からできます。  N  から indicates the materials are not immediately obvious. できる is used for general statements.
日本には木でできた家が多いが、この国の家はたいてい石でできている;In Japan, most houses are made out of wood, but houses in this country are usually made out of stone.;"---N でできている This grammar (でできている）is used when describing something specific. i.e. the ""plate"" and ""cup."""
この荷物の重さは何キロくらいでしょうか。;How heavy do you think this bag is? / I wonder how heavy;"The suffix さ is attached to the stem of an i-adjective or a na-adjective to form a noun. The typical effect is the addition of this suffix ""-ness,"" as in ""niceness"" or ""-ty,"" as in ""rarity."""
富士山の高さは何キロくらいでしょうか。;About how many meters is the height of Mt. Fuji, I wonder.;"The suffix さ is attached to the stem of an i-adjective or a na-adjective to form a noun. The typical effect is the addition of this suffix ""-ness,"" as in ""niceness"" or ""-ty,"" as in ""rarity."""
この話の良さがわからない人はいないと思います。;I don't think there's anyone who wouldn't understand the merit of this story.;"The suffix さ is attached to the stem of an i-adjective or a na-adjective to form a noun. The typical effect is the addition of this suffix ""-ness,"" as in ""niceness"" or ""-ty,"" as in ""rarity."""
日本の携帯電話の便利さには、びっくりした。;I was surprised by how useful Japanese cell phones are.;"The suffix さ is attached to the stem of an i-adjective or a na-adjective to form a noun. The typical effect is the addition of this suffix ""-ness,"" as in ""niceness"" or ""-ty,"" as in ""rarity."""
この本のよさがよく分かる。;"I know well the ""goodness"" of this book.";よさ　is the irregular conjugation of いい　to a noun by the addition of the suffix -さ。
これはチョコレートのように見えるけれど、消しゴムだから、食べられませんよ。;You can see that this looks like chocolate, but it is an eraser, so you can't eat it.;N のように used when X is as Y shows, says, explains.
この写真を見れば分かるように、ロンドンには、色々な名所がある。;As you can see if you look at these photos, there are various famous locations in London.;V-plain のように used when X does something as shown/said/explained/etc. in/by Y.
小さい猫の声は、赤ちゃんが泣いているように聞こえます。;The voice of a small cat sounds like a crying baby.;V-plain ように used when X resembles Y
 先生がおっしゃるように、言葉は毎日勉強しなければ上手にならないと思います。;Like our teacher says, I don't think you can become skillful at a language unless you practice every day.;V-plain ように used when X resembles Y
この写真を見れば分かるように、ロンドンには、色々な名所がある。;The kitten's meowing sounds like a baby crying.;V-plain ように used when X resembles Y
この本に書いてあるように作れば、おいしいドレッシングができるよ。;You can make delicious dressing if you follow the recipe in this book (lt. make it as if it's written in this book).;V-plain ように used when X resembles Y
小さい猫の声は、赤ちゃんが泣いているように聞こえます。;The voice of a small cat sounds like a crying baby.;V-plain ように used when X resembles Y
エジプトはピラミッドやスフィンクスで有名です。;Egypt is famous for pyramids and the sphinx.;ーはNで有名です。 -- is famous for N.
このお寺は古い桜の木があることで知られている。;This temple is known for its old cherry blossom trees.;---はSことで知られている。  --- is known for S(entence/statement).
熊は冬眠する(to hibernate)ことで知られていますが、動物園の熊も冬眠をしますか。;Bears are known for hibernating, but do bears in zoos hinbernate, too?;---はSことで知られている。  --- is known for S(entence/statement).
スミスさんは昼は大学で勉強し、夜は病院で掃除のアルバイトをしている。;Smith studies at college during the day and does part-time janitorial work at a hospital at night.;"A-stem + く、－  The stem of an i-adjective (多い）+ く indicate that the sentece is continuing and functions like ""and"" in english. This grammar is used only in WRITTEN form, the -て form is used in speech."
兄と違い、僕はスポーツがあまり得意じゃない。;Unlike my older brother, I'm not very good at sports.;"A-stem + く、－  The stem of an i-adjective (多い）+ く indicate that the sentece is continuing and functions like ""and"" in english. This grammar is used only in WRITTEN form, the -て form is used in speech."
あの図書館は日本の本が少なく、日本の新聞もなかったので、一度しか行かなかった。;That library didn't have many Japanese books, and it didn't have any Japanese newspaper either, so I only went there once.;"A-stem + く、－  The stem of an i-adjective (多い）+ く indicate that the sentece is continuing and functions like ""and"" in english. This grammar is used only in WRITTEN form, the -て form is used in speech."
この地方は冬は雪が多く、夏はとても暑い。;In this region, there is a lot of snow in the winter, and the summers are very hot.;"A-stem + く、－  The stem of an i-adjective (多い）+ く indicate that the sentece is continuing and functions like ""and"" in english. This grammar is used only in WRITTEN form, the -て form is used in speech."
昨日は友達とレストランで晩御飯を食べ、その後、映画を見に行った。;Yesterday I ate lunch at a restaurant with friends, and after that we went to see a movie.;"V-masu, --  The masu stem of a verb indicate that the sentence is continuing. That is, it functions like the english ""and."" This use of grammar is only for WRITTEN passages and FORMAL SPEECH; the ーて form is used for this purpose in typical spoken language."
晩御飯はたいてい家で食べますが、時々友達とレストランに行くこともあります。;I usually eat dinner at home, but there are times when I go out to eat with friends, too.;V-plain-nonpast こともある。 V-plain-nonpast こともある is used when something occurs (or someone does something) occasionally, and the も implies that something else may also occur. ***DO NOT CONFUSE with V-plain.PAST ことがある which states previous experience.
文法の説明を読んでもわからないことがある。そんな時は先生に聞きに行くことにしている。;Sometimes I can't understand the grammar even when I read the explanation. When that happens, I make it a habit to go ask my teacher.;V-plain-nonpast ことがある。 Used to indicated when something occurs (or someone does something) occassionally.  ***DO NOT CONFUSE with V-plain.PAST ことがある which states previous experience.
ハワイは1年中気温が高いけれど、高い山では雪が降ることもあるそうだ。;Hawaii is warm all year around, but I hear that there are times when it snows in the high mountains.;V-plain-nonpast こともある。 V-plain-nonpast こともある is used when something occurs (or someone does something) occasionally, and the も implies that something else may also occur. ***DO NOT CONFUSE with V-plain.PAST ことがある which states previous experience.
週末はたいてい両親の家に帰るが、忙しくて帰られないこともある。;I usually go home to my parent's house on weekends, but there are times when I get busy and can't go home.;V-plain-nonpast こともある。 V-plain-nonpast こともある is used when something occurs (or someone does something) occasionally, and the も implies that something else may also occur. ***DO NOT CONFUSE with V-plain.PAST ことがある which states previous experience.
文法の説明を読んでも分からないことがある;Sometimes I don't understand the grammar explanation even though I read it.;V-plain-nonpast ことがある。 Used to indicated when something occurs (or someone does something) occassionally.  ***DO NOT CONFUSE with V-plain.PAST ことがある which states previous experience.
日本人が大好きな桜の花がいつ頃咲くかは、場所によって違います。;The approximate blooming time for Sakura, beloved by the Japanese, differs depending on location;Question wordかはNによって違う。 This structure is used to indicate that something differs depending on the situation, location, time, etc.
性格(character)は人によって違います。;Character differs depending on the person.;NかはN2によって違う。  This structure is used to indicate that something differs depending on the situation, location, time, etc.
何歳で運転免許が取れるかは、国によって違うようです。;It seems that the age at which you can get your driver's license differs depending on the country.;NかはN2によって違う。  This structure is used to indicate that something differs depending on the situation, location, time, etc.
私にとって、読み物が難しいかどうかは、漢字の多さによります。;"To me, whether I find a book difficult or not depends on the ""numerousness"" of the kanji.";ーかどうかは、N2による。 Whether ー or not depends on N2.  This structure is used to indicate that something differs depending on the situation, location, time, etc.
授業料をいくら払わなくてはいけないかは、大学によって違う。;How much tuition you have to pay differs depending on the university.;NかはN2によって違う。  This structure is used to indicate that something differs depending on the situation, location, time, etc.
どの大学に留学するかは、もらえる奨学金による。;Where (lit. at what university) I study abroad depends on how big a scholarship I can get.;ーかは、N2による。 Whether ー or not depends on N2.  This structure is used to indicate that something differs depending on the situation, location, time, etc.
この地方では、１１月になると雪が降り始めます。;When it turns November in this region, snow begins to fall.;"V-masu　始める。  始める in this use is an auxiliary verb meaning ""begin to V."""
私の弟は1歳の時、歩き始めました。そして、1歳半になった時、話し始めました。;My little brother started walking when he was one year old. He started talking when he was one and a half.;"V-masu　始める。  始める in this use is an auxiliary verb meaning ""begin to V."""
 毎晩コーラスぶの練習があるので、勉強をし始めるのはいつも10時過ぎだ。;Because I have practice at chorus club every night, I always start studying after 10:00.;"V-masu　始める。  始める in this use is an auxiliary verb meaning ""begin to V."""
友達へのプレゼント。;a present for a friend.;N(particle)　のN2  The のmust be present in this grammar usage because it indicates that the N(particle) modifies N2. Without の, the N(particle) otherwise N(part) seems to modify the predicate in the clause. i.e. compare 先生とミーチングに行けない。(I can't go to meet the teacher) and 先生とのミーチングに行けない。(I can't go to the meeting with the teacher).
日本での仕事;a job in Japan;The のmust be present in this grammar usage because it indicates that the N(particle) modifies N2. Without の, the N(particle) otherwise N(part) seems to modify the predicate in the clause. i.e. compare 先生とミーチングに行けない。(I can't go to meet the teacher) and 先生とのミーチングに行けない。(I can't go to the meeting with the teacher).
 先生とのミーティング ;a meeting with the teacher;The のmust be present in this grammar usage because it indicates that the N(particle) modifies N2. Without の, the N(particle) otherwise N(part) seems to modify the predicate in the clause. i.e. compare 先生とミーチングに行けない。(I can't go to meet the teacher) and 先生とのミーチングに行けない。(I can't go to the meeting with the teacher).
八時からのパーティー。;a party which starts at 8.;The のmust be present in this grammar usage because it indicates that the N(particle) modifies N2. Without の, the N(particle) otherwise N(part) seems to modify the predicate in the clause. i.e. compare 先生とミーチングに行けない。(I can't go to meet the teacher) and 先生とのミーチングに行けない。(I can't go to the meeting with the teacher).
京都までの新幹線(しんかんせん）の切符（きっぷ）;a Shinkansen (bullet train) ticket to kyoto;The のmust be present in this grammar usage because it indicates that the N(particle) modifies N2. Without の, the N(particle) otherwise N(part) seems to modify the predicate in the clause. i.e. compare 先生とミーチングに行けない。(I can't go to meet the teacher) and 先生とのミーチングに行けない。(I can't go to the meeting with the teacher).
世界で一番長い川はナイルだと言われているが、アマゾン川だと言う人もいる。;The Nile river is said to be the longest river in the world, but there are also people who say it is the Amazon river.;"ーはSentence-plainと言われているがX  ""Sentence-plain"" is said to be ー、but X  This structure is used to introduce something commonly said about something or someone."
道後温泉は日本の一番古い温泉で、３０００年の歴史があると言われています。;It is said that the Dougo Onsen, with 3000 years of history, is the oldest onsen in Japan.;ーはS-plainと言われている。 It is said that ーis S-plain。
「電気の町」秋葉原は、最近「お宅の町」だとも言われている。;"Akihabara used to be called ""Electronics Town"", but now it's called ""Otaku Town""";ーはS-plainと言われている。 It is said that ーis S-plain。
 風を引いたときはビタミンCをたくさん撮るといいと言われている。;They say it's good to take lots of vitamin C when you get a cold.;ーはS-plainと言われている。 It is said that ーis S-plain。
日本の名所と言えば、温泉も忘れることはできません。;"Speaking of ""famous places of Japan,"" you can't forget about onsens.";"ーと言えば。 Literally means ""if you say that--,"" but translates better as ""Speaking of..."" and is used to present, as the topic, something or someone related to what has just been mentioned by the hearer or speaker."
 昔話と言えば、昨日「桃太郎」紙芝居を見ましたよ。;"Speaking of folk tales, yesterday I saw a ""Kamishibai"" performance of Momotarou.";"ーと言えば。 Literally means ""if you say that--,"" but translates better as ""Speaking of..."" and is used to present, as the topic, something or someone related to what has just been mentioned by the hearer or speaker."
道子さんと言えば、来月田中さんと結婚すると聞きましたが、本当ですか。;Speaking of Michiko, I heard that she's getting married to Mr. Tanaka next month. Is it true?;"ーと言えば。 Literally means ""if you say that--,"" but translates better as ""Speaking of..."" and is used to present, as the topic, something or someone related to what has just been mentioned by the hearer or speaker."
番港と言えば、山の上から見る夜の景色が素晴らしいそうですね。;Speaking of Hong Kong, I hear that the view at night from the of the hill (lit. mountain) is wonderful.;"ーと言えば。 Literally means ""if you say that--,"" but translates better as ""Speaking of..."" and is used to present, as the topic, something or someone related to what has just been mentioned by the hearer or speaker."
週末はたいてい洗濯とか掃除（とか）をします。;On weekends I usually do stuff like laundry and cleaning.;ーとか（－とか） とかis used to list examples non-exhaustively. It is similar to や in meaning when the examples listed are nouns. When 2+ examples are used the final とか is optional if followed by a particle as seen in this example. It is otherwise MANDATORY.
フィンランド語とかトルコ語とか、みんながあまり勉強してない言葉を勉強してみたい。;I want to try studying a language not many people learn, like Finnish or Turkish.;ーとか（－とか） とかis used to list examples non-exhaustively. It is similar to や in meaning when the examples listed are nouns. When 2+ examples are used the final とか is optional if followed by a particle as seen in this example. It is otherwise MANDATORY.
漢字を覚える時は、フラッシュカードを作るとか、何回も書くとかするといいです。;When trying to memorize kanji, making flashcards and writing them over and over is good to do.;ーとか（－とか） とかis used to list examples non-exhaustively. The final とか is MANDATORY because it is followed by する.  NOTE: UNLIKE や、とか can be used to list verb phrases, as seen here.
パソコンというのは、パーソナルコンピュータのことです。;"The meaning of ""persocon"" is ""personal computer.""";ーというのはNのことだ。 The meaning of ー is N.  This structure is used to provide a meaning or definition of a word or phrase.
すみません。学生証（がくせいしょう）というのは、何のことですか？;"I'm sorry, what does ""gakuseishou"" mean?";Nというのは、何のことですか。 What does N mean?/What is the meaning of N?
学生証というのは、Student IDのことですよ;"It means ""student ID"".";Nというのは、何のことですか。 What does N mean?/What is the meaning of N?
行事というのは、季節（きせつ）で決まった時に特別に何かを行うことです。;"The meaning of ""gyouji"" is a special, decided upon time of the season when something special occurs.";Nというのは、－という意味です  the meaning of N is ー。
留学するというのは、外国で勉強するということだ。;Ryuugakusuru means to study in a foreign country.;Nというのは、何のことですか。 What does N mean?/What is the meaning of N?
「話せる」というのは、「話すことができる」という意味だ。;"Hanaseru means ""to be able to speak"".";Nというのは、－という意味です  the meaning of N is ー。
日本語はひらがなだけでなく、カタカナや漢字も覚えなくてはいけません。;For Japanese, not only hiragana, but katakana and kanji must also be memorized.;N1 だけでなく、N2(prt)も  not only N1, but N2 also
"「すみません」は、""I'm sorry"" という意味だけでなく、""excuse me""　という意味もあります。";"sumimasen doesn't only mean ""I'm sorry,"" it also means ""excuse me.""";Sだけでなく、N(prt)も  Not just S is true, but also N
京都は古いお寺があるだけでなく、きれいな景色でも有名です。;Kyoto is famous not just for its old temples, but also for its beautiful scenery.;Sだけでなく、N(prt)も  Not just S is true, but also N
 このアパートは駅から近くて便利なだけじゃなくて、家賃も安いから、借りることにした。;Not only is this apartment conveniently close to the train station, but the rent's cheap, too, so I've decided to rent it.;Sだけでなく、N(prt)も  Not just S is true, but also N
 その映画は面白いだけじゃなくて、音楽もいいよ。;Not only is the movie interesting, the film's music is good, too.;Sだけでなく、N(prt)も  Not just S is true, but also N
宮崎駿（みやざき・はやお）のアニメって、いいよね。;As for Hayao, Miyazaki's anime, they're good aren't they?;"-Nって  As for N; Speaking of N-"
田中さん、５時に来るって言ってたけど、まだ来ないね。;Mr. Tanaka said he'd come around 5:00, but he still hasn't come, has he?;S/Nって言う say that S/N  って is the informal colloquial form of the quotative marker と
道子さんの出身って、どこ？;Where are you from, Michiko? / Where's Michiko from?;S/Nって言う say that S/N  って is the informal colloquial form of the quotative marker と
 漢字って、覚えてもすぐ忘れちゃうよね。; Kanji are like that - you forget them almost as soon as you've memorized them, don't you?;S/Nって言う say that S/N  って is the informal colloquial form of the quotative marker と
 田中さん、５時に来るって言ってたけど、まだ来ないね。;Mr. Tanaka said he'd come around 5:00, but he still hasn't come, has he?;S/Nって言う say that S/N  って is the informal colloquial form of the quotative marker と
明日はテストがないって聞いたけど、本当？;I heard there isn't a test tomorrow, but is that true?;S/Nって聞く heard that S/N  って is the informal colloquial form of the quotative marker と
ここに「静かにして下さい」って書いてあるのが見えませんか。;Please be quiet is written right here, can't you see it?;S/Nって書く S/N is written...  って is the informal colloquial form of the quotative marker と
僕の名前は「つとむ」だけど、友達は「トム」って呼んだ。;"My name is ""tsutomu,"" but my friends call me ""tom.""";S/Nって呼ぶ ...called S/N  って is the informal colloquial form of the quotative marker と
「桃太郎」っていう話、聞いたことある？;"Have you heard the story called ""Momotarou?""";N1っていうN2  The N2 called N1.  って is the informal colloquial form of the quotative marker と
日本語は〜話す相手によって話し方を変えなければいけないことがあります。;There are times in Japanese when you have to change the way you speak based on the partner you're talking to.;"V-nai(なければいけない）。 　Expresses idea of obligation (i.e. have to; must; should). ""いけない”　 is used when the sense of obligation is directed towards the hearer, in the sense of ""you (all) should..."""
まだちょっとしなきゃなんないことがあるんだ。;I still have some things to do.;"V-nai (なきゃなんない。)   used to indicate a sense of obligation. It is the very contracted form of なければならない　(ー＞なきゃならない　ー＞なきゃなんない。) use of ならない indicates the speakers own sense of obligation (I have to; must; should)"
国民はみんな税金を払わなければなりません。;All citizens have to pay taxes.;"V-nai (なきゃなんない。)   used to indicate a sense of obligation. It is the very contracted form of なければならない　(ー＞なきゃならない　ー＞なきゃなんない。) use of ならない indicates the speakers own sense of obligation (I have to; must; should)"
この（　）に入れるのは、助詞でなくてはいけません。;What you insert within this (    ) must be a particle.;"(V-nai) (なければいけない）。 Expresses idea of obligation (i.e. have to; must; should). ""いけない”　 is used when the sense of obligation is directed towards the hearer, in the sense of ""you (all) should..."""
調べなきゃならないことがあるので、図書館に行って来る。;I have things I have to research so I'm going to the library.;(V-nai) (なきゃならない）。 expresses idea of personal obligation (because of naranai). It is shortened from  なければならない　(ー＞なきゃならない　ー＞なきゃなんない。)
郵便局に行って来なくちゃんないから、ちょっとここで待ってて。;I've gotta run to the post office, so wait here for a sec.;V-nai (なくちゃなんない）  expresses personal sense of obligation (due to naranai). It is shortened from なくてはならないー＞なくちゃならないー＞なくちゃなんない。
今朝、朝寝坊してクラスに遅れちゃったから、明日はもっと早く起きなくちゃ。;This morning I overslept and ended up being late for class, so I've gotta wake up earlier tomorrow.;V-nai なくちゃ。 Expresses obligation. Shortened from なくては。 In the sentence final position the いけない／ならない　can be dropped.
病院に行って来なくちゃなんない。;I have to go to the hospital.;V-nai (なくちゃなんない）  expresses personal sense of obligation (due to naranai). It is shortened from なくてはならないー＞なくちゃならないー＞なくちゃなんない。
