昔は、「男のくせに泣くのはよくない」とか「女のくせに強すぎる」とか言いましたが、今日ではそう思う人は少なくなってきたと思います。;"In the past, people used to say things like ""men shouldn't cry"" and ""you're too strong for a woman"", but I think there are fewer people who think like that now.";"〜くせに Means: Although~; in spite of the fact that~; and yet~ This conjunction is used when something commonly expected from information in the subordinate clause (i.e. the くせに phrase/clause) does not happen or is not the case. In most situations, くせに expresses the speaker's anger, frustration or disagreement. This emotion is not directed toward the speaker, but toward the hearer or 3rd person. When くせに is used, the subject of the main clause and that of the subordinate clause must be the same. If the subjects differ, you must use なのに、."
Regular form of this contraction? 書いてる;かいている ~てる => ~ている;
Regular form?  飲んでます;のんでいます  〜てますー＞〜ています;
Regular form?  読んでた;よんでいた  〜てたー＞〜ていた;
Regular form?  この部屋じゃ小さすぎて、。。。;では  〜じゃー＞〜では;
Regular form?  早く起きなくちゃ。。。;起きなくては（いけない／ならない） 〜なくちゃー＞〜なくては（X）;
Regular form?  話さなきゃ;話さなければ（いけない／ならない）;
Regular form? 忘れちゃう;忘れてしまう;
Regular form?  食べちゃった;食べてしまった;
Regular form?  買っといた;買っておいた （as in 買っておく）;
Regular form?  寝とく;寝ておく;
Regular form?  宿題も出しといたげる;宿題も出しておいてあげる;
Regular form?  説明したげる;説明してあげる;
Regular Form?  出したげた;出してあげた;
レポート、今、書いてるとこ（ろ）だから、書き終わったら見てくれる？;I'm in the middle of writing the report now - would you mind looking at it when I'm done?;In casual conversation contracted forms are commonly used.
この部屋じゃ小さすぎて、30人も集まるパーティなんて出来ないなあ。;This room would be too small. There's no way we can have a party here for thirty people.;In casual conversation contracted forms are commonly used.
友達を空港まで送ったげなきゃいけないから、明日は、早く起きなくちゃ。;I've gotta take a friend to the airport, so I need to get up early tomorrow.;In casual conversation contracted forms are commonly used.
先生の言ったこと、ノートに書いとかないと、忘れちゃうよ。;If you don't write down what the professor says, you end up forgetting it, you know.;In casual conversation contracted forms are commonly used.
読み物、買っといたから、何も持ってできなくていいよ。;I bought the drinks, so you don't have to bring anything.;In casual conversation contracted forms are commonly used.
私も宿題を出しに行かなくちゃい行けないから、マイクの宿題も出しといたげる。;I've gotta go turn in my homework, so I'll turn yours in for you also, Mike.;In casual conversation contracted forms are commonly used.
漢字が苦手だと言っても、全然書けないわけではない。;Although I say that kanji is my weak point, that doesn't mean I can't write them at all.;"{V/A} (という）わけではない。  Means: It's not that~;  It doesn't mean that used to deny a statement."
試験の点が良ければいい成績が取れるというわけではない。宿題やプロジェクトも大切だ。;You can't count on getting good grades just because you score well on tests. Homework and projects are important, too.;"{N/ANo} {という／だった／じゃない／じゃなかった} わけではない Means: It's not that~;  It doesn't mean that used to deny a statement."
お金のためだけに働いているわけではないけれど、給料は高い方がいい。;The money isn't the only reason I work, but I'd rather have a high salary.;"{V/A} (という）わけではない。  Means: It's not that~;  It doesn't mean that used to deny a statement."
あの人が嫌いなわけではないんですが、デートしたいとは思いません。;It's not that I dislike that person, I don't think I want to date (him/her).;"ANa {な／だった／じゃない／じゃなかった} わけではない Means: It's not that~;  It doesn't mean that used to deny a statement."
この料理はまずいわけではないけど、油が多いから、あまり食べられない。;I don't mean that this dish is yucky, it's that there's a lot of oil so I can't eat much.;"{V/A} (という）わけではない。  Means: It's not that~;  It doesn't mean that used to deny a statement."
ネコというわけではない;It's not that it's a cat.;"{N/ANo} {という／だった／じゃない／じゃなかった} わけではない Means: It's not that~;  It doesn't mean that used to deny a statement."
経済は政治と深い関係がある。;Economics is profoundly related to politics.;N1 は N2 {と／に}関係がある。  This sentence is used to show that N1 is related in someway to N2. The particle after N1 may be  と or に。 When this pattern is used in relative clauses, の is commonly used after 関係 instead of が。
そのトピックに関係のある本はこの列にあります。;A book related to that topic is in this row.;N1 {と/に} 関係 {が/の} あるN2.  This sentence is used to show that N1 is related in someway to N2. The particle after N1 may be  と or に。 When this pattern is used in relative clauses, の is commonly used after 関係 instead of が。
授業に関係のない質問はしないようにしましょう。;Try not to ask questions that are not related to the lesson.;N1 {と/に} 関係 {が/の} あるN2.  This sentence is used to show that N1 is related in someway to N2. The particle after N1 may be  と or に。 When this pattern is used in relative clauses, の is commonly used after 関係 instead of が。
それは、僕には関係がないから、知らないなあ。;That is not related to me, so I don't know about it.;N1 は N2 {と／に}関係がある。  This sentence is used to show that N1 is related in someway to N2. The particle after N1 may be  と or に。 When this pattern is used in relative clauses, の is commonly used after 関係 instead of が。
ハイブリッドの車が増えたことによって、町の空気がきれいなってきました。;Because hybrid cars increased, the city's air came to be cleaner.;"~ことによって  によって indicates the cause, the means, or the agent in passive sentences. In this sentence it indicates CAUSE.  ""because; because of; due to; by V-ing; by means of; via; through; by"""
地球温暖化によって北極(the North Pole)の氷が溶けて(to melt)いるらしい。;I've heard that, as an effect of global warming, the ice in the Arctic is melting.;"~ことによって  によって indicates the cause, the means, or the agent in passive sentences. In this sentence it indicates CAUSE.  ""because; because of; due to; by V-ing; by means of; via; through; by"""
インターネットで調べることによって、世界中で今起こっていることを知ることが出来る。;By means of internet search, you can know what is happening right now throughout the world.;"~ことによって  によって indicates the cause, the means, or the agent in passive sentences. In this sentence it indicates MEANS.  ""because; because of; due to; by V-ing; by means of; via; through; by"""
言葉は、話したり読んだり書いたりすることによって学んでいくのです。;One learns a language by speaking, reading, and writing it.;"~ことによって  によって indicates the cause, the means, or the agent in passive sentences. In this sentence it indicates MEANS.  ""because; because of; due to; by V-ing; by means of; via; through; by"""
万有引力の法則(the law of universal gravitation)はニュートンによって発見されました。;The law of universal gravitation was discovered by Newton.;"~N によって  によって indicates the cause, the means, or the agent in passive sentences. In this sentence it indicates AGENT.  ""because; because of; due to; by V-ing; by means of; via; through; by"""
青と黄色の絵の具を混ぜます。すると、緑色になります。;Mix the colors blue and yellow. They become green.;"S1. すると、S2. ""then""  すると connects two sentences S1 and S2 in three situations.  In this particular case, it is  (1) The action in S1 causes what is said in S2"
亀は一生懸命走って行きました。すると、ウサギが途中で寝ているのが見えました。;The tortoise ran as hard as he could. Then, he saw the hare sleeping along the way.;"S1. すると、S2. ""then""  すると connects two sentences S1 and S2 in three situations.  In this particular case, it is  (1) The action in S1 causes what is said in S2"
このアイコンをクリックして下さい。すると、コンピュータの画面の文字が大きくなります。;Please click this icon. That will make the letters on the screen become bigger.;"S1. すると、S2. ""then""  すると connects two sentences S1 and S2 in three situations.  In this particular case, it is  (2) The action in S1 leads to the discovery of what is said in S2"
A) 田中さんは、明日の会議に出られないそうですよ。 B) すると、誰か他の人が出なくてはいけないということですね。;A) I heard Tanaka-san will be unable to come to tomorrow's meeting. B) Then, that means that somebody else will have to go, doesn't it?;"S1. すると、S2. ""then""  すると connects two sentences S1 and S2 in three situations.  In this particular case, it is  (3) From the information implied in S1, the speaker confirms that S2 is the case."
母が教えてくれた通り作ったら、おいしいケーキができた。;I made it just as my mother taught me, and the cake turned out great.;"V-plain 通り（に） ""the way; as; exactly like; following; according to""  When 通り is modified by a verb or noun, it means ""the way; as someone does; as something indicates."" 通り can also be used as a suffix, in which case 通り is directly affixed to nouns and the pronunciation changes from とおり to どおり。"
空手部では、先輩に言われた通りにしないと、怒られてしまう。;In karate club, if you don't do exactly as you're told by your upperclassmen, you will make them angry.;"V-plain 通り（に） ""the way; as; exactly like; following; according to""  When 通り is modified by a verb or noun, it means ""the way; as someone does; as something indicates."" 通り can also be used as a suffix, in which case 通り is directly affixed to nouns and the pronunciation changes from とおり to どおり。"
日本のファミリーレストランの店員は、みんなマニュアルの通りに話すから、ロボットみたいだ。;Employees at Japanese family restaurants all repeat the lines straight out of the training manual - they're like robots.;"N　の 通り（に） ""the way; as; exactly like; following; according to""  When 通り is modified by a verb or noun, it means ""the way; as someone does; as something indicates."" 通り can also be used as a suffix, in which case 通り is directly affixed to nouns and the pronunciation changes from とおり to どおり。"
指示通りに、ここに答えを書いて下さい。;Please write your answers here as indicated by the instructions.;"N通り（に） Where 通り is a suffix and reads as どおり。  ""the way; as; exactly like; following; according to""  When 通り is modified by a verb or noun, it means ""the way; as someone does; as something indicates."" 通り can also be used as a suffix, in which case 通り is directly affixed to nouns and the pronunciation changes from とおり to どおり。"
外国語は話せば話すほど、上手になります。そして、読めば読むほど、単語が増えます。;The more you speak a foreign language, the more skilled you become. In addition, the more you read, the more your vocabulary increases.;"{V/A}-cond {V/A}-plain ほど   ""the (more) ~, the (more) ~""  This structure is used when the more something happens or is in some state, the more another thing happens or is in some state. (When V is a suru verb, the second VN is usually omitted)"
運動すればするほど、健康になれるし、やせられるから、運動は一石二鳥ですね。;"The more you exercise, the healthier and more slim you become; exercise kills two birds with one stone, don't you think?";"{V/A}-cond {V/A}-plain ほど   ""the (more) ~, the (more) ~""  This structure is used when the more something happens or is in some state, the more another thing happens or is in some state.  (When V is a suru verb, the second VN is usually omitted, as is seen in this sentence)"
アパートは駅に近ければ近いほど家賃が高くなり、逆に、駅から遠ければ遠いほど安くなる。;The closer an apartment is to the train station to more expensive rent becomes. Inversely, the farther an apartment is from the train stations, the cheaper it becomes.;"{V/A}-cond {V/A}-plain ほど   ""the (more) ~, the (more) ~""  This structure is used when the more something happens or is in some state, the more another thing happens or is in some state.  (When V is a suru verb, the second VN is usually omitted)"
親が立派であればあるほど、子供はプレッシャーを感じてしまうようだ。;The more prominent/splended parents are, the more pressure children feel.;"{Ana/NP} であれば ({ANa/NP}で)あるほど  ""the (more) ~, the (more) ~""  This structure is used when the more something happens or is in some state, the more another thing happens or is in some state.  (In this case, it appears that Ana in this structure do not need to be restated before ほど)"
いい大学であればあるほど入るのが難しいです。;The better the university, the harder it is to get in.;"{Ana/NP} であれば ({ANa/NP}で)あるほど  ""the (more) ~, the (more) ~""  This structure is used when the more something happens or is in some state, the more another thing happens or is in some state.  (In this case, it appears that Ana in this structure do not need to be restated before ほど)"
便利なら便利なほど...;The more convenient it is...;"ANa ならANa　なほど  ""the (more) ~, the (more) ~""  This structure is used when the more something happens or is in some state, the more another thing happens or is in some state."
今、見たビデオから、文楽や歌舞伎は江戸時代に一般の人々にも広がったということが分かります。さて、次に紹介するのは、これも江戸時代に一般の人にも楽しまれるようになった茶道です。;We understand from the video we've just watched that bunraku and kabuki became popular among the common people, too, during the Edo Period. Now, the next thing I'm going to introduce is the tea ceremony, which also became popular among commoners during the Edo Period.;"(S1.) さて、S2.  ""well; now; well now""  さて always occurs at the beginning of a sentence and signals that (a) the speaker/writer is beginning a new topic (the new topic and the previous topic may be part of the same discourse)  (b) the speaker/writer is going to ask a question about the information just provided, AS SEEN HERE or  (c) the speaker is leaving.  さてis not used in casual situations."
ある日、うさぎとかめが競走をしました。さて、どちらがレースに勝ったでしょうか。;One day, a rabbit and a turtle raced. Well now, which one won the race do you suppose?;"(S1.) さて、S2.  ""well; now; well now""  さて always occurs at the beginning of a sentence and signals that (a) the speaker/writer is beginning a new topic (the new topic and the previous topic may be part of the same discourse)  (b) the speaker/writer is going to ask a question about the information just provided, AS SEEN HERE or  (c) the speaker is leaving.  さてis not used in casual situations."
さて、もう遅いですだら、今日はこれで失礼します。;Well, its already late, so I'm going to excuse myself for today.;"(S1.) さて、S2.  ""well; now; well now""  さて always occurs at the beginning of a sentence and signals that (a) the speaker/writer is beginning a new topic (the new topic and the previous topic may be part of the same discourse)  (b) the speaker/writer is going to ask a question about the information just provided, or  (c) the speaker is leaving. AS SEEN HERE  さてis not used in casual situations."
古代のヨーロッパはローマを中心として発展した。;Ancient Europe developed with Rome at its center.;"N を 中心 {と/に} (して）  ""(centering) around; focusing on; mainly; with N as the center/focus/leader/etc.""  Nを中心(と/に)する literally means ""to make N the center."" This phrase takes 2 forms. The form used here is used to modify verbs. The phrase indicates that something takes place around N or with N as the center/focus, or that someone does something focusing on N."
地球や火星、木星、金星などの惑星は、太陽を中心として回っている;The planets Earth, Mars, Jupiter, Venus, etc. go around their center, the sun.;"N を 中心 {と/に} (して）  ""(centering) around; focusing on; mainly; with N as the center/focus/leader/etc.""  Nを中心(と/に)する literally means ""to make N the center."" This phrase takes 2 forms. The form used here is used to modify verbs. The phrase indicates that something takes place around N or with N as the center/focus, or that someone does something focusing on N."
示教に熱心な信者は、示教活動を中心に生活をしている。;The most fervent followers of religions center their lives around religious activities.;"N を 中心 {と/に} (して）  ""(centering) around; focusing on; mainly; with N as the center/focus/leader/etc.""  Nを中心(と/に)する literally means ""to make N the center."" This phrase takes 2 forms. The form used here is used to modify verbs. The phrase indicates that something takes place around N or with N as the center/focus, or that someone does something focusing on N."
台風が近いづいているため、九州を中心に大雨が降っている。;Due to the approaching typhoon, heavy rain is falling, centered in Kyushu.;"N を 中心 {と/に} (して）  ""(centering) around; focusing on; mainly; with N as the center/focus/leader/etc.""  Nを中心(と/に)する literally means ""to make N the center."" This phrase takes 2 forms. The form used here is used to modify verbs. The phrase indicates that something takes place around N or with N as the center/focus, or that someone does something focusing on N."
私は、最近、日本の若者言語を中心とした言語の研究をしています。;Lately, I am making the language of young Japanese people the focus of my language research.;"N1を中心(と/に)した N2 (= N1中心のN2)  ""(centering) around; focusing on; mainly; with N as the center/focus/leader/etc.""  N1を中心(と/に)する   literally means ""to make N the center."" This phrase takes 2 forms. The form used here is used to modify nouns. The phrase indicates that something takes place around N or with N as the center/focus, or that someone does something focusing on N."
日本と私の国は、朝と夜が逆だ。いま、こちらは午後９時だが、日本は午前１０時だ。;The mornings and evenings in my country are opposite that of Japan. Here it is 9PM, but in Japan it is 10AM.;"X は 逆 だ。 ""be opposite; the other way""   逆 is used to indicate that X's way of doing something is the opposite of Y's way of doing it, or that the way X is or the way X happens is the opposite of the way Y is or the way Y happens. In different contexts, ぎゃくindicates that X's way of doing something, the way X is or the way X happens is the opposite of the way which is common, expected or intended."
私と両親の教えはいつも逆だ。どうしてこんなに意見が違うのだろう。;My ideas and my parents, ideas are always opposite. Why do we have such different opinions on things?;"X は 逆 だ。 ""be opposite; the other way""   逆 is used to indicate that X's way of doing something is the opposite of Y's way of doing it, or that the way X is or the way X happens is the opposite of the way Y is or the way Y happens. In different contexts, ぎゃくindicates that X's way of doing something, the way X is or the way X happens is the opposite of the way which is common, expected or intended."
ダイエットのために運動を始めたら、おなかが空いてたくさん食べてしまい、逆に太ってしまった。;When I started exercising to lose weight, I got hungry and ate a lot, so I gained weight contrary to my intention.;"逆 に V。 ""in the opposite direction; the other way; the wrong way; contrary to one's expectations; contrary to one's intention; conversely""   逆 is used to indicate that X's way of doing something is the opposite of Y's way of doing it, or that the way X is or the way X happens is the opposite of the way Y is or the way Y happens. In different contexts, ぎゃくindicates that X's way of doing something, the way X is or the way X happens is the opposite of the way which is common, expected or intended."
日本語で数字を１００から逆に数えてみて下さい。;Try counting backwards (lit. numbers in the opposite direction) from 100 in Japanese, please.;"逆 に V。 ""in the opposite direction; the other way; the wrong way; contrary to one's expectations; contrary to one's intention; conversely""   逆 is used to indicate that X's way of doing something is the opposite of Y's way of doing it, or that the way X is or the way X happens is the opposite of the way Y is or the way Y happens. In different contexts, ぎゃくindicates that X's way of doing something, the way X is or the way X happens is the opposite of the way which is common, expected or intended."
一方通行の道だということを知らないで、逆の方向に進んでしまい、警察につかまってしまった。;I went against traffic, not realizing it was a one-way street, and ended up getting pulled over by the police.;"逆 の N。 ""opposite N; the reverse of N""   逆 is used to indicate that X's way of doing something is the opposite of Y's way of doing it, or that the way X is or the way X happens is the opposite of the way Y is or the way Y happens. In different contexts, ぎゃくindicates that X's way of doing something, the way X is or the way X happens is the opposite of the way which is common, expected or intended."
あの映画は面白いはずだよ。映画先行の友達が3回も見たって言ってたから。;That movie must be interesting because my friend majoring in film studies told me that he'd seen it three times.;"{V/A} -plain はず　[seen here]  ANa {な/じゃない/だった/じゃなかった)  N {の/じゃない/だった/じゃなかった}  ""Should; I expect that ~; I believe that~""  The dependent noun はず indicates that the speaker/writer or someone he/she empathizes with believes or expects that what is stated before はず is true based on his/her knowledge or memory at the moment of speech or at the time of the event stated in the main clause. The negative form can be either 〜ないはずだ or 〜はずがない.However, the sense of negation is stronger in はずがない. When Sはずだ modifies a noun, の must be used between はず and the noun."
その本なら、大学の図書館に行けば、あるはずだよ。;That book? They should have it at the university library - I've borrowed it before.;"{V/A} -plain はず　[seen here]  ANa {な/じゃない/だった/じゃなかった)  N {の/じゃない/だった/じゃなかった}  ""Should; I expect that ~; I believe that~""  The dependent noun はず indicates that the speaker/writer or someone he/she empathizes with believes or expects that what is stated before はず is true based on his/her knowledge or memory at the moment of speech or at the time of the event stated in the main clause. The negative form can be either 〜ないはずだ or 〜はずがない.However, the sense of negation is stronger in はずがない. When Sはずだ modifies a noun, の must be used between はず and the noun."
田中さんからメールの返事ができない。送ったはずのメールが届かなかったようだ。;Mr. Tanaka hasn't replied to my e-mail. I'm sure I sent it, but it looks like it didn't reach him.;"{V/A} -plain はず　[seen here]  ANa {な/じゃない/だった/じゃなかった)  N {の/じゃない/だった/じゃなかった}  ""Should; I expect that ~; I believe that~""  The dependent noun はず indicates that the speaker/writer or someone he/she empathizes with believes or expects that what is stated before はず is true based on his/her knowledge or memory at the moment of speech or at the time of the event stated in the main clause. The negative form can be either 〜ないはずだ or 〜はずがない.However, the sense of negation is stronger in はずがない. When Sはずだ modifies a noun, の must be used between はず and the noun."
