問題が難しかったにもかかわらず、試験はよくできた。;Although the questions were difficult, I did well on the exam.;"X にもかかわらず Y where X is  {V/A}-plain   ANa {な／じゃない／だった／じゃなかった}  N {の／じゃない／だった／じゃなかった}  ""in spite of (the fact that ~); despite (the fact that ~); although; though; nevertheless""  This construction is used to mean ""Y in spite of X."" It is used when Y is the case even though Y is not usually expected from X."
彼女は外国人(である)にもかかわらず、日本人より日本の文化を恋している。;Although she's a foreigner, she loves Japanese culture more than Japanese people do.;"X にもかかわらず Y where X is  {V/A}-plain   ANa {な／じゃない／だった／じゃなかった}  N {の／じゃない／だった／じゃなかった}  ""in spite of (the fact that ~); despite (the fact that ~); although; though; nevertheless""  This construction is used to mean ""Y in spite of X."" It is used when Y is the case even though Y is not usually expected from X."
オオカミ少年の言ったことは本当だったにもかかわらず、その前に何回も嘘をついていたので、誰も少年の言う事を信じなかった。;Although the boy who cried wolf was telling the truth, no one believed him because of all the lies he had told before.;"X にもかかわらず Y where X is  {V/A}-plain   ANa {な／じゃない／だった／じゃなかった}  N {の／じゃない／だった／じゃなかった}  ""in spite of (the fact that ~); despite (the fact that ~); although; though; nevertheless""  This construction is used to mean ""Y in spite of X."" It is used when Y is the case even though Y is not usually expected from X."
せっかく日本語を３年も勉強したのだから、ぜひ一度、日本に行ってみたいです。;I've spent three whole years studying Japanese, so Id' really love to visit Japan once.;"せっかく V {のだから/のに} ""with effort; at great pain; take the trouble to do ~; ~, which is a rare occasion/event/etc.""  せっかく is used in 2 situations: (1) when the speaker/writer does something with a lot of effort or at great pain ad therefore he/she wants to make use of it; or, in spite of the effort or pain, he/she cannot make use of it. (this is the case here)"
せっかくケーキを焼いたのに、誰も食べてくれなかったから、がっかりした。;I went to all the trouble to bake a cake but no one would eat it - it was so disappointing.;"せっかく V {のだから/のに} ""with effort; at great pain; take the trouble to do ~; ~, which is a rare occasion/event/etc.""  せっかく is used in 2 situations: (1) when the speaker/writer does something with a lot of effort or at great pain ad therefore he/she wants to make use of it; or, in spite of the effort or pain, he/she cannot make use of it. (this is the case here)"
せっかく日本に行ったのに、ホームステイが出来なくて、残念だった。;It was too bad that I went all the way to Japan and wasn't able to do a homestay.;"せっかく V {のだから/のに} ""with effort; at great pain; take the trouble to do ~; ~, which is a rare occasion/event/etc.""  せっかく is used in 2 situations: (1) when the speaker/writer does something with a lot of effort or at great pain ad therefore he/she wants to make use of it; or, in spite of the effort or pain, he/she cannot make use of it. (this is the case here)"
せっかくの野球の試合が雨で中止になってしまった。;The baseball game we'd been looking forward to ended up being called off due to rain.;"せっかくのN ""with effort; at great pain; take the trouble to do ~; ~, which is a rare occasion/event/etc.""  せっかく is used in 2 situations: (2) when a given opportunity is rare and therefore he/she wants to make use of it; or, in spite of their opportunity, he/she cannot make use of it"
せっかくですが、今日は仕事が忙しくて。;This is a rare (event, invitation, etc), but I'm busy with work today...;"せっかく{ですが／ですけど／だけど／etc}  ""with effort; at great pain; take the trouble to do ~; ~, which is a rare occasion/event/etc.""  せっかく is used in 2 situations: (2) when a given opportunity is rare and therefore he/she wants to make use of it; or, in spite of their opportunity, he/she cannot make use of it"
A:　今夜、私の家に食事にいらっしゃいませんか。　B:　ありがとうございます。でも、せっかくですが、今日は仕事が忙しくて、、、;A: Would you like to come to my house tonight for dinner?  B: Thank you. I hate to pass up such a kind of invitation, but I'm afraid I'm rather busy with work today.;"せっかく{ですが／ですけど／だけど／etc}  ""with effort; at great pain; take the trouble to do ~; ~, which is a rare occasion/event/etc.""  せっかく is used in 2 situations: (2) when a given opportunity is rare and therefore he/she wants to make use of it; or, in spite of their opportunity, he/she cannot make use of it"
春だと言っても、寒くてまだセーターを着ている。;It's technically spring, but it's still so cold that I'm wearing sweaters.;"{ANa/N} + {だ／じゃない／だった／じゃなかった} {と／って} 言っても  ""although ~ say/said that ~; even though ~ say/said that ~"""
漢字が読めると言っても、まだ300ぐらいしか読めませんから、新聞の内容は全然わかりません。;I say I can read kanji, but I can read only about 300, so I can't understand newspaper articles at all.;"{V/A}-plain {と/って} 言っても  ""although ~ say/said that ~; even though ~ say/said that ~""  Its used to clarify what has just been said in order to avoid misunderstanding. って is used in place of と in casual conversation or writing."
この文法は難しいと言っても、全部分からないわけではない。;Although I say that this grammar is difficult, that doesn't mean I don't understand it at all.;"{V/A}-plain {と/って} 言っても  ""although ~ say/said that ~; even though ~ say/said that ~""  Its used to clarify what has just been said in order to avoid misunderstanding. って is used in place of と in casual conversation or writing."
大学に近くて便利だって言っても、家賃が高すぎるから、この部屋は借りられない。;Even if its location is close to the university, the rent for this room is too high for me to rent it.;"{V/A}-plain {と/って} 言っても  ""although ~ say/said that ~; even though ~ say/said that ~""  Its used to clarify what has just been said in order to avoid misunderstanding. って is used in place of と in casual conversation or writing."
子供だと言っても、ばかにしてはいけない。;You shouldn't underestimate him just because he's a child.;"{ANa/N} + {だ／じゃない／だった／じゃなかった} {と／って} 言っても  ""although ~ say/said that ~; even though ~ say/said that ~"""
予定が思うように進まないので、とても困っています。;The schedule is not going as planned and I'm having a lot of trouble.;"思うように〜ない [->typically, ~ is V-potential]  ""not ~ as one wishes""  This phrase means that something is not in accord with the speaker's/writer's (or the subject's) wish or desire.  The verb potential form is usually used in this structure.)"
人の前では自分の考えが思うように言えない。;In front of other people I can't express my thoughts the way I'd like to.;"思うように〜ない [->typically, ~ is V-potential]  ""not ~ as one wishes""  This phrase means that something is not in accord with the speaker's/writer's (or the subject's) wish or desire.  The verb potential form is usually used in this structure.)"
子供の時、ピアノを一生懸命に練習したけど、思うように引けなかったので、辞めてしまった。;When I was young I practiced piano as hard as I could, but I wasn't able to play as well as I wanted, so I ended up quitting.;"思うように〜ない [->typically, ~ is V-potential]  ""not ~ as one wishes""  This phrase means that something is not in accord with the speaker's/writer's (or the subject's) wish or desire.  The verb potential form is usually used in this structure.)"
私たちは話も出来ないほど疲れていた。;We were so tired we couldn't even speak.;"V-plain.non-past ほど ""to the extent that~ ; so~ that ~ (almost)~; not as ~ as N; to (this/that) degree; (this/that) much""  The particle ほど is used to express the degree of a state. When a sentence precedes ほど, the element just before ほど is a verb."
疲れていて話もできないほどだった。;We were so tired we couldn't even speak.;"V-plain.non-past ほど ""to the extent that~ ; so~ that ~ (almost)~; not as ~ as N; to (this/that) degree; (this/that) much""  The particle ほど is used to express the degree of a state. When a sentence precedes ほど, the element just before ほど is a verb."
このカレーは涙ができるほど辛い。;This curry is so spicy it brings tears to your eyes.;"V-plain.non-past ほど ""to the extent that~ ; so~ that ~ (almost)~; not as ~ as N; to (this/that) degree; (this/that) much""  The particle ほど is used to express the degree of a state. When a sentence precedes ほど, the element just before ほど is a verb."
このカレーは辛くて涙が出るほどだ。;This curry is so spicy it brings tears to your eyes.;"V-plain.non-past ほど ""to the extent that~ ; so~ that ~ (almost)~; not as ~ as N; to (this/that) degree; (this/that) much""  The particle ほど is used to express the degree of a state. When a sentence precedes ほど, the element just before ほど is a verb."
フォトショップを使うと、写真の編集が驚くほど簡単にできる。;It's surprisingly easy to edit photos when you use Photoshop.;"V-plain.non-past ほど ""to the extent that~ ; so~ that ~ (almost)~; not as ~ as N; to (this/that) degree; (this/that) much""  The particle ほど is used to express the degree of a state. When a sentence precedes ほど, the element just before ほど is a verb."
私はチョコレートが死ぬほど好きだ。毎日でも食べる。;I love chocolate to death! I eat it almost every day.;"V-plain.non-past ほど ""to the extent that~ ; so~ that ~ (almost)~; not as ~ as N; to (this/that) degree; (this/that) much""  The particle ほど is used to express the degree of a state. When a sentence precedes ほど, the element just before ほど is a verb."
日本語は、話せることは話せるが、通訳ができるほどではない。;I can speak Japanese alright, but not well enough to act as an interpreter.;"V-plain.non-past ほど ""to the extent that~ ; so~ that ~ (almost)~; not as ~ as N; to (this/that) degree; (this/that) much""  The particle ほど is used to express the degree of a state. When a sentence precedes ほど, the element just before ほど is a verb."
私は日本語が上手に話せることは話せるが、スミスさんほどではない。;I'm good enough at Japanese, but I'm not as fluent as Mr. Smith.;"N のほど  ""to the extent that~ ; so~ that ~ (almost)~; not as ~ as N; to (this/that) degree; (this/that) much""  The particle ほど is used to express the degree of a state. When a sentence precedes ほど, the element just before ほど is a verb"
これほどすばらしい絵を見たことがない。;I've never seen a picture as great as this.;"DemPほど ""to the extent that~ ; so~ that ~ (almost)~; not as ~ as N; to (this/that) degree; (this/that) much""  The particle ほど is used to express the degree of a state. When a sentence precedes ほど, the element just before ほど is a verb"
1年に700万人以上の人が訪れるという。;It is said over 7 million visit each year.;"S-plain という ""It is said that ~; They say that ~""  This structure indicate that the preceding information is not first hand. This is a polite form."
ロンドンの大英博物館(The British Museum)には、約700万点のコレクションがあるという。;It's said that the British Museum in London has around seven million pieces in its collection.;"S-plain という ""It is said that ~; They say that ~""  This structure indicate that the preceding information is not first hand. This is a polite form."
聖徳太子(Prince Shotaku)という人物は、一度に十人の人が話していることが分かったという。;They say that Prince Shotaku could listen to eight people talking at once and understand all of them.;"S-plain という ""It is said that ~; They say that ~""  This structure indicate that the preceding information is not first hand. This is a polite form."
世界で最も観光客が多い国はフランスで、1年に700万人以上の人が小戸ずれるという。;It's said that France is the most popular tourist destination in the world, with more than seven million visitors a year.;"S-plain という ""It is said that ~; They say that ~""  This structure indicate that the preceding information is not first hand. This is a polite form."
病状に合わせて、いろいろな薬が使われる。;A variety of medicines are used depending on the condition of the patient.;"N に会わせて  ""making ~ suitable for N; according to N""  The literal meaning this grammar is ""fitting/matching/adjusting something to N"" and is often used to mean ""making something suitable for N"" or ""according to N"""
人々の生活の変化に合わせて、家の形も変わってきました。;The housing styles have changed in order to match the change in people's lifestyles.;"N に会わせて  ""making ~ suitable for N; according to N""  The literal meaning this grammar is ""fitting/matching/adjusting something to N"" and is often used to mean ""making something suitable for N"" or ""according to N"""
このリストの中から、予算に合った商品を選ぶことができます。;You can choose products from this list in accordance with your budget.;"N1 に会った N2  ""N2 suitable for N1"""
子供には、子供の年齢に合った本を与えた方がいいですよ。;You should give children books that are suitable for their age.;"N1 に会った N2  ""N2 suitable for N1"""
冬の間、カエルは、まるで死んだように動きません。;During the winter, frogs remain motionless as if they were dead.;"まるで V-plain ように ""as if ~ (were/-ed); just like""  This structure is used to introduce  a simile, i.e., to describe a thing, person, action, etc. by comparing it with a similar thing, person, action, etc. まるで is an emphatic marker."
まだ春なのに、今日はまるで夏のように暑い。;It's still spring, but today is so hot it seems almost like summer.;"まるで N {の／じゃない／だった／じゃなかった} ように  ""as if ~ (were/-ed); just like""  This structure is used to introduce  a simile, i.e., to describe a thing, person, action, etc. by comparing it with a similar thing, person, action, etc. まるで is an emphatic marker."
このロボットは、まるで人間のように歩くことができます。;This robot can walk such a way that is almost looks like a human.;"まるで N {の／じゃない／だった／じゃなかった} ように  ""as if ~ (were/-ed); just like""  This structure is used to introduce  a simile, i.e., to describe a thing, person, action, etc. by comparing it with a similar thing, person, action, etc. まるで is an emphatic marker."
あの小娘は、まるで子猫のようだ。;That young girl is just like a kitten.;"Sentence ending form: 〜ようだ。 ""as if ~ (were/-ed); just like""  This structure is used to introduce  a simile, i.e., to describe a thing, person, action, etc. by comparing it with a similar thing, person, action, etc. まるで is an emphatic marker."
まるで天子のような女。;A woman just like an angel.;"sentence ending form: 〜ようなN.  ""as if ~ (were/-ed); just like""  This structure is used to introduce  a simile, i.e., to describe a thing, person, action, etc. by comparing it with a similar thing, person, action, etc. まるで is an emphatic marker."
明日の試験では、言うまでもなく、文法の問題が出ます。;Needless to say, there will be grammar questions on tomorrow's test.;"（Xは）言うまでもなく、S。 ""needless to say; it goes without saying that ~; it is obvious that ~; not to mention ~; let alone ~""  This phrase is used when the speaker mentions something obvious or something assumed to be known to the hearer. It is commonly used in written language."
図書館では静かにしなくてはいけないことは、言うまでもない。;It goes without saying that you need to be quiet in the library.;"S {こと／の} は言うまでもない。  ""needless to say; it goes without saying that ~; it is obvious that ~; not to mention ~; let alone ~""  This phrase is used when the speaker mentions something obvious or something assumed to be known to the hearer. It is commonly used in written language."
世界で人気がある日本のポップカルチャーには、アニメは言うまでもなく、ファッションや音楽などもある。;Anime is a given, but fashion and music are also a part of the Japanese pop culture popular around the world.;"N1 は言うまでもなく N2 も  ""needless to say; it goes without saying that ~; it is obvious that ~; not to mention ~; let alone ~""  This phrase is used when the speaker mentions something obvious or something assumed to be known to the hearer. It is commonly used in written language."
日本のトイレには、お湯がお尻を洗うトイレから、ふたが自動で開くトイレまでもある。;There are Japanese toilets that wash your bottom with warm water and even those that have self-opening lids.;"N1 から N2 までも ""even; to even""  までも is used to present something which is considered to be beyond one's expectation or imagination."
この教科書では、漢字や文法だけでなく、日本の現代の文化から歴史までも学べる。;In this textbook, you can learn not only kanji and grammar, but also contemporary Japanese culture and even history.;"N1 だけでなく N2 まで（も） ""even; to even""  までも is used to present something which is considered to be beyond one's expectation or imagination."
最近では、歩くだけでなく、サッカーをするロボットまである。;Recently, there are even robots that not only walk but also play soccer.;"N まで（も） ""even; to even""  までも is used to present something which is considered to be beyond one's expectation or imagination."
健康のためには、肉でも、野菜でも、なんでもバランスよく食べなくてはいけませんよ。;To be healthy, you must eat in a balanced way, whether it's meat or vegetables or something else.;"N1 でも N2 でも ""including X and Y; whether (it is) X or Y""  This is used to provide examples for the statement in the sentence. This structure implies that there are also things other than the examples which make the statement true. Note that XもYも (both X and Y) does not carry such an implication.."
「隣のトトロ」でも、「風の谷のナウシカ」でも、宮崎駿のアニメはみんな素晴らしい。;"From ""My Neighbor Totoro"" to ""Nausica and the Valley of the Wind"", (no matter the choice) all of Hayao Miyazaki's anime are superb.";"N1 でも N2 でも ""including X and Y; whether (it is) X or Y""  This is used to provide examples for the statement in the sentence. This structure implies that there are also things other than the examples which make the statement true. Note that XもYも (both X and Y) does not carry such an implication.."
このゲームは、子供でも大人でも楽しむことが出来ます。;Everyone from children to adults can enjoy this game.;"N1 でも N2 でも ""including X and Y; whether (it is) X or Y""  This is used to provide examples for the statement in the sentence. This structure implies that there are also things other than the examples which make the statement true. Note that XもYも (both X and Y) does not carry such an implication.."
コンビニには、生活用品でも食べ物でも雑誌や新聞でも、なんでも置いてある。;They've got everything at convenience stores, from everyday essentials to food to magazines and newspapers.;"N1 でも N2 でも ""including X and Y; whether (it is) X or Y""  This is used to provide examples for the statement in the sentence. This structure implies that there are also things other than the examples which make the statement true. Note that XもYも (both X and Y) does not carry such an implication.."
オリンピックは4年に1度行われることになっています。したがって、次のオリンピックは今回のオリンピックから4年後です。;It's a rule that the Olympic Games are held once every four years. Accordingly, the next Olympics will be four years from this Olympics.;"S1 (reason/cause). したがって、S２ (consequence.)  ""therefore; accordingly; consequently; as a result; so"""
英語は世界で最も使われている言葉の一つだ。したがって、英語を義務教育の中に入れている国は多い。;English is one of the most widely-used languages in the world. As a result, many countries have made the English language a part of their compulsory education.;"S1 (reason/cause). したがって、S２ (consequence.)  ""therefore; accordingly; consequently; as a result; so"""
コーヒーにはたくさんカフェインが入っている。したがって、飲み過ぎると寝られなくなる。;There's a lot of caffeine in coffee. Because of this, if you drink too much you won't be able to sleep.;"S1 (reason/cause). したがって、S２ (consequence.)  ""therefore; accordingly; consequently; as a result; so"""
この教科書を使うようになって、学生たちの日本語がどんどん上達したというのは事実だ。;It's a fact that once we started using this textbook, the student's Japanese improved rapidly.;"S　(という）のは事実だ。 ""It is {true/a fact that} ~""  Used when the speaker wants to claim that something is true or is a fact, or when he/she admits that something is true or a fact. The presence or absence of という does not change the meaning."
東京は物価が高いことだけでなく、土地も狭いので、暮らしにくいというのは事実だ。;The fact is that Tokyo is a hard place to live in, not only because the prices are high there but also because the land is small (i.e. there are too many people for the land);"S　(という）のは事実だ。 ""It is {true/a fact that} ~""  Used when the speaker wants to claim that something is true or is a fact, or when he/she admits that something is true or a fact. The presence or absence of という does not change the meaning."
私が彼のことが好きだというのは事実だが、将来彼と結婚しようと思っているわけではない。;It's true that I like him, but it's not that I'm thinking about marrying him in the future.;"S　(という）のは事実だ。 ""It is {true/a fact that} ~""  Used when the speaker wants to claim that something is true or is a fact, or when he/she admits that something is true or a fact. The presence or absence of という does not change the meaning."
教育という点から考えると、マンガにはテント悪い点がある。;From an educational standpoint, there are both good and bad things about manga.;"N という点から考えると ""to view from the standpoint of ~; from the perspective of ~""  used to indicate someone's view from the standpoint of X. Examples of X include business, environment, education, etc."
便利さという点から考えると、このアパートが一番だ。;From a convenience standpoint, this apartment is the best.;"N という点から考えると ""to view from the standpoint of ~; from the perspective of ~""  used to indicate someone's view from the standpoint of X. Examples of X include business, environment, education, etc."
面白さという点から考えると、この小説はあまり面白くないが、でも、歴史的なことが分かるので勉強になる。;From the standpoint of being interesting, this novel is not very interesting, but you can learn some things about history, so it is informative.;"N という点から考えると ""to view from the standpoint of ~; from the perspective of ~""  used to indicate someone's view from the standpoint of X. Examples of X include business, environment, education, etc."
教育の平等という点から考えると、現在の教育制度には問題がある。;From the point of view of equality in education, there are problems with the current educational system.;"N という点から考えると ""to view from the standpoint of ~; from the perspective of ~""  used to indicate someone's view from the standpoint of X. Examples of X include business, environment, education, etc."
最近の子供は、外で遊ばない上に本も読まないらしい。;They say that children these days not only don't play outdoors, they don't even read books.;"S 上に ""in addition to~; besides~; not only~but also~; moreover~; ~ as well""  The conjunction 上に introduces additional information emphatically."
